<?xml version="1.0" encoding="UTF-8"?>
<list xmlns:xsi="http://www.w3.org/2001/XMLSchema-instance" xsi:noNamespaceSchemaLocation="../../../xsd/teleporterData.xsd">
	<npc id="35605"> <!-- Angout -->
		<teleport name="tel1" type="OTHER">
			<location name="Village Square" x="147728" y="-56331" z="-2776" />
			<location name="North Gate Entrance" x="147731" y="-58930" z="-2976" />
			<location name="East Gate Entrance" x="150561" y="-57489" z="-2976" />
			<location name="West Gate Entrance" x="144866" y="-57464" z="-2976" />
		</teleport>
		<teleport name="tel2" type="OTHER">
			<location name="Village Square" x="147728" y="-56331" z="-2776" />
			<location name="North Gate Entrance" x="147731" y="-58930" z="-2976" />
			<location name="East Gate Entrance" x="150561" y="-57489" z="-2976" />
			<location name="West Gate Entrance" x="144866" y="-57464" z="-2976" />
			<location name="Varka Silenos Barracks" x="125740" y="-40864" z="-3736" feeCount="500" />
			<location name="Ketra Orc Outpost" x="146990" y="-67128" z="-3640" feeCount="500" />
			<location name="Entrance to the Forge of the Gods" x="169018" y="-116303" z="-2432" feeCount="500" />
			<location name="Wall of Argos" x="165054" y="-47861" z="-3560" feeCount="500" />
			<location name="Hot Springs" x="144880" y="-113468" z="-2560" feeCount="500" />
		</teleport>
	</npc>
</list>
