<?xml version="1.0" encoding="UTF-8"?>
<list xmlns:xsi="http://www.w3.org/2001/XMLSchema-instance" xsi:noNamespaceSchemaLocation="../../xsd/teleporterData.xsd">
	<npc id="30320"> <!-- Richlin -->
		<teleport type="NORMAL">
			<location name="The Town of Gludio" x="-12694" y="122776" z="-3114" feeCount="7300" castleId="1" />
			<location name="Talking Island Village" x="-84141" y="244623" z="-3729" feeCount="9400" />
			<location name="Elven Village" x="46890" y="51531" z="-2976" feeCount="16000" />
			<location name="Dark Elf Village" x="9709" y="15566" z="-4568" feeCount="16000" />
			<location name="Dwarven Village" x="115120" y="-178224" z="-917" feeCount="38000" />
			<location name="Orc Village" x="-45186" y="-112459" z="-236" feeCount="26000" />
			<location name="Langk Lizardman Dwellings" x="-44763" y="203497" z="-3592" feeCount="1800" />
			<location name="Windmill Hill" x="-75437" y="168800" z="-3632" feeCount="550" />
			<location name="Fellmere Harvesting Grounds" x="-63736" y="101522" z="-3552" feeCount="1400" />
			<location name="Forgotten Temple" x="-53001" y="191425" z="-3568" feeCount="2000" />
			<location name="Orc Barracks" x="-89763" y="105359" z="-3576" feeCount="1800" />
			<location name="Windy Hill" x="-88539" y="83389" z="-2864" feeCount="2600" />
			<location name="Abandoned Camp" x="-49853" y="147089" z="-2784" feeCount="1200" />
			<location name="Wastelands" x="-16526" y="208032" z="-3664" feeCount="3400" />
			<location name="Red Rock Ridge" x="-42256" y="198333" z="-2800" feeCount="3700" />
		</teleport>
		<teleport type="NOBLES_TOKEN">
			<location name="Gludin Arena" x="-87328" y="142266" z="-3640" feeId="6651" feeCount="1" />
			<location name="Giran Arena" x="73579" y="142709" z="-3768" feeId="6651" feeCount="1" />
			<location name="Center of the Forgotten Temple" x="-54026" y="179504" z="-4650" feeId="6651" feeCount="1" />
			<location name="Wastelands, Western Region" x="-47506" y="179572" z="-3632" feeId="6651" feeCount="1" />
			<location name="Coliseum" x="146440" y="46723" z="-3400" feeId="6651" feeCount="1" />
		</teleport>
		<teleport type="NOBLES_ADENA">
			<location name="Gludin Arena" x="-87328" y="142266" z="-3640" feeCount="1000" />
			<location name="Giran Arena" x="73579" y="142709" z="-3768" feeCount="1000" />
			<location name="Center of the Forgotten Temple" x="-54026" y="179504" z="-4650" feeCount="1000" />
			<location name="Wastelands, Western Region" x="-47506" y="179572" z="-3632" feeCount="1000" />
			<location name="Coliseum" x="146440" y="46723" z="-3400" feeCount="1000" />
		</teleport>
	</npc>
</list>
