<?xml version="1.0" encoding="UTF-8"?>
<list xmlns:xsi="http://www.w3.org/2001/XMLSchema-instance" xsi:noNamespaceSchemaLocation="../../xsd/teleporterData.xsd">
	<npc id="31964"> <!-- Bilia -->
		<teleport type="NORMAL">
			<location name="Rune Township" x="43835" y="-47749" z="-792" feeCount="10000" castleId="8" />
			<location name="Town of Goddard" x="147596" y="-56294" z="-2776" feeCount="10000" castleId="7" />
			<location name="Town of Aden" x="146705" y="25840" z="-2000" feeCount="53000" castleId="5" />
			<location name="Town of Oren" x="83011" y="53207" z="-1470" feeCount="59000" castleId="4" />
			<location name="Heine" x="111455" y="219400" z="-3546" feeCount="100000" castleId="6" />
			<location name="The Town of Giran" x="83458" y="148012" z="-3400" feeCount="87000" castleId="3" />
			<location name="The Town of Dion" x="15671" y="142994" z="-2704" feeCount="88000" castleId="2" />
			<location name="The Town of Gludio" x="-12694" y="122776" z="-3114" feeCount="85000" castleId="1" />
			<location name="Orc Village" x="-45158" y="-112583" z="-236" feeCount="13000" />
			<location name="Dwarven Village" x="115120" y="-178224" z="-917" feeCount="4400" />
			<location name="Den of Evil" x="68693" y="-110438" z="-1904" feeCount="3000" />
			<location name="Plunderous Plains" x="111965" y="-154172" z="-1528" feeCount="1600" />
			<location name="Frozen Labyrinth" x="113903" y="-108752" z="-848" feeCount="3500" />
			<location name="Crypts of Disgrace" x="47692" y="-115745" z="-3744" feeCount="1900" />
			<location name="Pavel Ruins" x="91280" y="-117152" z="-3928" feeCount="2100" />
		</teleport>
		<teleport type="NOBLES_TOKEN">
			<location name="Gludin Arena" x="-87328" y="142266" z="-3640" feeId="6651" feeCount="1" />
			<location name="Giran Arena" x="73579" y="142709" z="-3768" feeId="6651" feeCount="1" />
			<location name="Frost Lake" x="107577" y="-122392" z="-3632" feeId="6651" feeCount="1" />
			<location name="Crypts of Disgrace" x="44221" y="-114232" z="-2784" feeId="6651" feeCount="1" />
			<location name="Sky Wagon Relic" x="121618" y="-141554" z="-1496" feeId="6651" feeCount="1" />
			<location name="Coliseum" x="146440" y="46723" z="-3400" feeId="6651" feeCount="1" />
		</teleport>
		<teleport type="NOBLES_ADENA">
			<location name="Gludin Arena" x="-87328" y="142266" z="-3640" feeCount="1000" />
			<location name="Giran Arena" x="73579" y="142709" z="-3768" feeCount="1000" />
			<location name="Frost Lake" x="107577" y="-122392" z="-3632" feeCount="1000" />
			<location name="Crypts of Disgrace" x="44221" y="-114232" z="-2784" feeCount="1000" />
			<location name="Sky Wagon Relic" x="121618" y="-141554" z="-1496" feeCount="1000" />
			<location name="Coliseum" x="146440" y="46723" z="-3400" feeCount="1000" />
		</teleport>
	</npc>
</list>
