<?xml version="1.0" encoding="UTF-8"?>
<list xmlns:xsi="http://www.w3.org/2001/XMLSchema-instance" xsi:noNamespaceSchemaLocation="../../xsd/teleporterData.xsd">
	<npc id="35555"> <!-- August -->
		<teleport type="OTHER">
			<location name="Front Of Schuttgart Castle" x="76358" y="-145548" z="-1176" />
			<location name="Schuttgart Town Square" x="87379" y="-142322" z="-1336" />
			<location name="Front of the Archaic Fortress" x="105007" y="-140874" z="-3360" />
			<location name="The Center of the Abandoned Coal Mines" x="144706" y="-173223" z="-1520" feeCount="500" />
			<location name="Plunderous Plains" x="111965" y="-154172" z="-1528" feeCount="500" />
			<location name="Den of Evil" x="68693" y="-110438" z="-1946" feeCount="500" />
			<location name="Ice Merchant Cabin" x="113903" y="-108752" z="-860" feeCount="500" />
			<location name="Crypts of Disgrace" x="47692" y="-115745" z="-3744" feeCount="500" />
		</teleport>
	</npc>
</list>
