<?xml version="1.0" encoding="UTF-8"?>
<list xmlns:xsi="http://www.w3.org/2001/XMLSchema-instance" xsi:noNamespaceSchemaLocation="../../../xsd/teleporterData.xsd">
	<npc id="35572"> <!-- Jimmy -->
		<teleport name="tel1" type="OTHER">
			<location name="Village Square" x="43889" y="-49101" z="-792" />
			<location name="South Gate Entrance" x="43307" y="-46563" z="-816" />
			<location name="North Gate Entrance" x="40909" y="-52670" z="-896" />
		</teleport>
		<teleport name="tel2" type="OTHER">
			<location name="Village Square" x="43889" y="-49101" z="-792" />
			<location name="South Gate Entrance" x="43307" y="-46563" z="-816" />
			<location name="North Gate Entrance" x="40909" y="-52670" z="-896" />
			<location name="Forest of the Dead" x="52107" y="-54328" z="-3158" feeCount="500" />
			<location name="Wild Beast Pastures" x="43805" y="-88010" z="-2780" feeCount="500" />
			<location name="Swamp of Screams" x="69340" y="-50203" z="-3314" feeCount="500" />
			<location name="Valley of Saints" x="65307" y="-71445" z="-3696" feeCount="500" />
			<location name="Monastery of Silence" x="106414" y="-87799" z="-2949" feeCount="500" />
			<location name="Shyeed's Cavern" x="76911" y="-55295" z="-5824" feeCount="500" />
		</teleport>
	</npc>
</list>
