<?xml version="1.0" encoding="UTF-8"?>
<list xmlns:xsi="http://www.w3.org/2001/XMLSchema-instance" xsi:noNamespaceSchemaLocation="../../../xsd/teleporterData.xsd">
	<npc id="35383"> <!-- Tamutak -->
		<teleport name="tel1" type="OTHER">
			<location name="Village Square" x="19025" y="145245" z="-3107" />
			<location name="East Gate Entrance" x="21511" y="145866" z="-3153" />
			<location name="North Gate Entrance" x="18891" y="142365" z="-3051" />
			<location name="South Gate Entrance" x="17394" y="147593" z="-3129" />
			<location name="West Gate Entrance" x="16582" y="144130" z="-2960" />
		</teleport>
		<teleport name="tel2" type="OTHER">
			<location name="Village Square" x="19025" y="145245" z="-3107" />
			<location name="East Gate Entrance" x="21511" y="145866" z="-3153" />
			<location name="North Gate Entrance" x="18891" y="142365" z="-3051" />
			<location name="South Gate Entrance" x="17394" y="147593" z="-3129" />
			<location name="West Gate Entrance" x="16582" y="144130" z="-2960" />
			<location name="Cruma Marshlands" x="5106" y="126916" z="-3664" feeCount="500" />
			<location name="Fortress of Resistance" x="47382" y="111278" z="-2104" feeCount="500" />
			<location name="Plains of Dion" x="630" y="179184" z="-3720" feeCount="500" />
			<location name="Tanor Canyon" x="60374" y="164301" z="-2856" feeCount="500" />
			<location name="Entrance to Floran Village" x="17430" y="170103" z="-3506" feeCount="500" />
		</teleport>
	</npc>
</list>
