<?xml version="1.0" encoding="UTF-8"?>
<list xmlns:xsi="http://www.w3.org/2001/XMLSchema-instance" xsi:noNamespaceSchemaLocation="../../../xsd/teleporterData.xsd">
	<npc id="35582"> <!-- Stanley -->
		<teleport name="tel1" type="OTHER">
			<location name="Village Square" x="87379" y="-142322" z="-1336" />
			<location name="West Gate Entrance" x="84753" y="-141051" z="-1536" />
			<location name="South Gate Entrance" x="87347" y="-139802" z="-1536" />
			<location name="East Gate Entrance" x="89959" y="-141034" z="-1536" />
		</teleport>
		<teleport name="tel2" type="OTHER">
			<location name="Village Square" x="87379" y="-142322" z="-1336" />
			<location name="West Gate Entrance" x="84753" y="-141051" z="-1536" />
			<location name="South Gate Entrance" x="87347" y="-139802" z="-1536" />
			<location name="East Gate Entrance" x="89959" y="-141034" z="-1536" />
			<location name="Crypts of Disgrace" x="47692" y="-115745" z="-3744" feeCount="500" />
			<location name="Plunderous Plains" x="111965" y="-154172" z="-1528" feeCount="500" />
			<location name="Den of Evil" x="68693" y="-110438" z="-1946" feeCount="500" />
			<location name="Ice Merchant Cabin" x="113903" y="-108752" z="-860" feeCount="500" />
		</teleport>
	</npc>
</list>
